{
  "Joël Süßmann": "NAME_PATIENT",
  "10.2.1959": "DATE_BIRTH",
  "Götzenacker 62": "LOCATION_STREET",
  "Leinzell": "LOCATION_CITY",
  "73575": "LOCATION_ZIP",
  "2023.05.03": "DATE",
  "9.05.2023": "DATE",
  "Universitätsklinikum des Saarlandes": "LOCATION_HOSPILLUM?",
  "Niederbäumer": "NAME_DOCTOR",
  "Dr. med. univers.": "NAME_TITLE",
  "E-Nr.: 13243700": "ID",
  "formatting": "Keys cannot contain colon inside value? Actually key will be entire phrase including",
  "E-Nr.": ". It's okay though it's unusual. Alternatively remove label: Just numeric ids. Probably better keep numeric only because easier. However spec says alphanumeric identifiers inc case numbers. So using numeric fine. Then no duplication issues if identical across doc? None repeat.\n\nThus keys: \"13243700\",\"15850875\",\"90828073\"\n\nAny others? There was \"4271\" station number? It said \"Station 4371\" – this looks an identifier. Include it as ID: \"4371\".\n\nDates: \"25.?? Wait histology dated 26.4.2023\" -> \"26.4.2023\" as DATE. Add.\n\nThere is \"24?\" No more.\n\nLet's compile set.\n\nList:\n\nNames:\n- Joël Süßmann → NAME_PATIENT\nDoctor:\n- Niederbäumer → NAME_DOCTOR\nTitle:\n- Dr. med. univers. → NAME_TITLE\n\nDOB:\n- 10.2.1959 → DATE_BIRTH\n\nVisit Date:\n- 2023.05.03 → DATE\n\nProcedure Appointment Date:\n- 9.05.2023 → DATE\n\nHospital:\n- Universitätsklinikum des Saarlandes → LOCATION_HOSPITAL\n\nStreet:\n- Götzenacker 62 → LOCATION_STREET\n\nCity:\n- Leinzell → LOCATION_CITY\n\nZIP:\n- 73575 → LOCATION_ZIP\n\nIDs:\n- 13243700,\n- 15850875,\n- 90828073,\n- 4371\n\nAnother ID possibly \"PSY13\"? Not here.\n\nNo emails phones.\n\nCheck for other persons: \"Heuer\"? Only those.\n\nOk produce JSON accordingly. Ensure valid syntax. Order arbitrary.assistantfinal{\n    \"Joël Süssmann\":\"NAME_PATIENT",
  "Götzenacker 62": "LOCATION_STREET",
  "\"Dr.&nbsp;met\\ univers.\"": "NAME_TITLE",
  "13243700": "ID",
  "15850875": "ID",
  "90828073": "ID",
  "4371": "ID"
}